<specificationShort id="Confidentiality_short" xmlns:xsi="http://www.w3.org/2001/XMLSchema-instance" xsi:noNamespaceSchemaLocation="xsd_aniketosShort.xsd">
  <identifier>Confidentiality</identifier> 
<parameter>
  <type>string</type> 
  <identifier>Send_Document</identifier> 
  </parameter>
<parameter>
  <type>string</type> 
  <identifier>Receive_Document</identifier> 
  </parameter>
</specificationShort> 